{
  "schema_version": 1,
  "created_at": "2026-09-16T21:43:20Z",
  "tool": "image-processing calibrate_distortion 0.1.0",
  "camera": {
    "body": "ILCE-7RM5",
    "serial": null,
    "lens": "FE PZ 16-35mm F4 G",
    "zoom_position": null,
    "focus_position": 11,
    "units": "sdk_raw",
    "aperture": "f/8",
    "shutter": "1/160",
    "iso": 100
  },
  "develop": {
    "user_flip": 0,
    "half_size": false,
    "note": "geometry-affecting rawpy.postprocess params used",
    "rawpy_version": "0.27.0",
    "libraw_version": "0.22.1",
    "demosaic": "DHT"
  },
  "image_size": [
    9564,
    6376
  ],
  "model": "opencv_standard",
  "camera_matrix": [
    [
      4396.411804721653,
      0.0,
      4815.512915824186
    ],
    [
      0.0,
      4397.447534446346,
      3203.40829965517
    ],
    [
      0.0,
      0.0,
      1.0
    ]
  ],
  "dist_coeffs": [
    -0.12835072150163543,
    0.045657436069169534,
    0.00042613983758674017,
    0.0005286087201515691,
    -0.009905406186789315
  ],
  "lateral_ca": {
    "r_norm": 5747.248733089599,
    "R": {
      "coeffs": [
        0.00016934814547506067,
        0.0002806815709570415,
        -0.0003712827136035683
      ],
      "rms_residual_px": 0.14570589206367734,
      "max_shift_px_at_corner": 0.4838248152510781
    },
    "B": {
      "coeffs": [
        0.0003609297649641756,
        -0.0002475765513585291,
        0.0007232138002993294
      ],
      "rms_residual_px": 0.22798656648750315,
      "max_shift_px_at_corner": 4.9273061650263275
    }
  },
  "quality": {
    "n_frames_detected": 46,
    "n_frames_failed_detection": 0,
    "n_frames_used": 41,
    "n_frames_rejected": 0,
    "n_holdout": 5,
    "rms_reprojection_px": 0.35517251850618897,
    "holdout_rms_px": 0.32628002208507045,
    "per_image_rms_px": {
      "DSC00275.ARW": 0.34734968430370633,
      "DSC00276.ARW": 0.42547334843184687,
      "DSC00277.ARW": 0.3968519320724653,
      "DSC00278.ARW": 0.39066054837438213,
      "DSC00279.ARW": 0.37286147552104293,
      "DSC00280.ARW": 0.41883583106351613,
      "DSC00281.ARW": 0.6291945065729573,
      "DSC00282.ARW": 0.3872097258102379,
      "DSC00283.ARW": 0.38668907589870594,
      "DSC00284.ARW": 0.42370718424876014,
      "DSC00285.ARW": 0.39082168605030526,
      "DSC00286.ARW": 0.3741304270918058,
      "DSC00287.ARW": 0.30462428696286836,
      "DSC00288.ARW": 0.33486538403147886,
      "DSC00289.ARW": 0.39673259253287235,
      "DSC00290.ARW": 0.37826286440603724,
      "DSC00291.ARW": 0.39915548002975015,
      "DSC00292.ARW": 0.3888869840914871,
      "DSC00293.ARW": 0.33481554220922766,
      "DSC00294.ARW": 0.3370313785999851,
      "DSC00295.ARW": 0.48977382426586047,
      "DSC00299.ARW": 0.3639145933352612,
      "DSC00300.ARW": 0.3336798935658385,
      "DSC00301.ARW": 0.30114301382278263,
      "DSC00302.ARW": 0.3207404515902561,
      "DSC00303.ARW": 0.34537821239139865,
      "DSC00304.ARW": 0.32391066270655167,
      "DSC00305.ARW": 0.32638199244556393,
      "DSC00306.ARW": 0.2973021772602097,
      "DSC00307.ARW": 0.30101588065755275,
      "DSC00308.ARW": 0.2929909195921502,
      "DSC00309.ARW": 0.266370842256814,
      "DSC00310.ARW": 0.2681821445269849,
      "DSC00311.ARW": 0.24022427890477255,
      "DSC00312.ARW": 0.2808324592336795,
      "DSC00313.ARW": 0.274618302171295,
      "DSC00314.ARW": 0.33368005356530706,
      "DSC00315.ARW": 0.23687297379367284,
      "DSC00316.ARW": 0.23824279222571146,
      "DSC00317.ARW": 0.24598628706589076,
      "DSC00318.ARW": 0.35240710194251657
    },
    "holdout_per_image_rms_px": {
      "DSC00296.ARW": 0.34403618974062433,
      "DSC00297.ARW": 0.3604355749132005,
      "DSC00298.ARW": 0.3699313581345487,
      "DSC00319.ARW": 0.29550530944079073,
      "DSC00320.ARW": 0.24463434531141515
    },
    "rejected_frames_rms_px": {},
    "detection_failures": [],
    "coverage_grid_4x3": [
      [
        5,
        19,
        18,
        7
      ],
      [
        11,
        37,
        37,
        13
      ],
      [
        7,
        21,
        21,
        10
      ]
    ],
    "model_selection": "auto: standard kept (holdout 0.326 vs rational 0.301 px, within noise)",
    "straight_line_test": {
      "frame": "DSC00296.ARW",
      "max_bow_px_before": 20.134787419350264,
      "max_bow_px_after": 0.6383299520103092,
      "center_crop": {
        "crop": "center 50%",
        "max_bow_px_before": 20.134787419350264,
        "max_bow_px_after": 0.6383299520103092
      }
    },
    "invalid_output_fraction": 0.0
  },
  "sources": [
    "DSC00275.ARW",
    "DSC00276.ARW",
    "DSC00277.ARW",
    "DSC00278.ARW",
    "DSC00279.ARW",
    "DSC00280.ARW",
    "DSC00281.ARW",
    "DSC00282.ARW",
    "DSC00283.ARW",
    "DSC00284.ARW",
    "DSC00285.ARW",
    "DSC00286.ARW",
    "DSC00287.ARW",
    "DSC00288.ARW",
    "DSC00289.ARW",
    "DSC00290.ARW",
    "DSC00291.ARW",
    "DSC00292.ARW",
    "DSC00293.ARW",
    "DSC00294.ARW",
    "DSC00295.ARW",
    "DSC00299.ARW",
    "DSC00300.ARW",
    "DSC00301.ARW",
    "DSC00302.ARW",
    "DSC00303.ARW",
    "DSC00304.ARW",
    "DSC00305.ARW",
    "DSC00306.ARW",
    "DSC00307.ARW",
    "DSC00308.ARW",
    "DSC00309.ARW",
    "DSC00310.ARW",
    "DSC00311.ARW",
    "DSC00312.ARW",
    "DSC00313.ARW",
    "DSC00314.ARW",
    "DSC00315.ARW",
    "DSC00316.ARW",
    "DSC00317.ARW",
    "DSC00318.ARW"
  ],
  "holdout_sources": [
    "DSC00296.ARW",
    "DSC00297.ARW",
    "DSC00298.ARW",
    "DSC00319.ARW",
    "DSC00320.ARW"
  ],
  "sha256_of_sources": "c7f189ca27193ac4e16c29f51aaba9a73145568371e4c324bb8f5de578c83f97"
}
